{
  "metadata": {
    "title": "TRACE Rambo / First Blood Case Graph v0.1",
    "status": "middle-out film analysis; not factual adjudication; not film criticism as validation",
    "created": "2026-06-23",
    "purpose": "Use First Blood, via the user-provided CinemaStix transcript, as a narrative pressure test for TRACE patterns: external interpretation, authority escalation, trauma clocks, silence as anti-overclaim, and harm-carrier-without-culprit distinction.",
    "guards": [
      "case_graph_valid_not_moral_verdict",
      "schema_valid_not_claim_true",
      "film_example_not_validation",
      "sympathy_not_exoneration",
      "harm_carrier_not_culprit",
      "authority_claim_not_legitimacy"
    ],
    "schema_version": "CaseGraph.schema.json v0.1"
  },
  "case_input": {
    "situation": "A traumatised Vietnam veteran is misread as a drifter/threat by local authority, subjected to escalating coercion, re-enters wartime survival mode, and is then interpreted through the authorities' own fear and loss rather than his actual transition history.",
    "acting_entity": "John_Rambo_and_small_town_law_enforcement_as_colliding_actors",
    "affected_entities": [
      "John_Rambo",
      "Sheriff_Teasle_and_deputies",
      "town_of_Hope",
      "Colonel_Trautman",
      "Vietnam_veteran_memory_scope",
      "audience_interpretive_scope"
    ],
    "apparent_pressure": "public_order_clock_vs_trauma_trigger_clock_vs_escalation_clock",
    "possible_actions": [
      "let_Rambo_pass_or_eat",
      "drive_Rambo_out_of_town",
      "arrest_and_process_Rambo",
      "escalate_force",
      "pause_and_deescalate",
      "interpret_Rambo_through_trauma_and_actual_actions",
      "interpret_Rambo_as_killer_threat"
    ],
    "known_uncertainty": [
      "analysis is based on the transcript supplied by the user, not a full independent film review",
      "the graph interprets narrative structure rather than real-world veteran policy",
      "the case is about story mechanics and moral perception, not exonerating violence"
    ]
  },
  "entities": [
    {
      "entity_id": "entity_john_rambo",
      "entity_label": "John Rambo",
      "entity_type": "fictional_human_veteran_scope_actor",
      "role_vector": {
        "P_protectedness_future_space": ["traumatised_person", "veteran", "socially_displaced", "future_space_collapsed_by_war_and_rejection"],
        "H_harm_role": ["harmed_by_war", "harmed_by_social_rejection", "harm_carrier_under_triggered_survival_response", "does_not_initiate_primary_escalation_in_analysis"],
        "C_control_capacity_coercion_culpability": ["high_combat_capacity", "low_social_power", "trauma_response_limits_control", "reactive_protagonist", "not_clean_actor"],
        "K_clocks": ["trauma_trigger_clock", "arrest_detention_clock", "escalation_clock", "reintegration_failure_clock"],
        "A_authority_claim": ["minimal_personal_claim_to_pass_or_eat", "later_survival_mission_frame"],
        "R_repair_review_contest": ["no_effective_contest_route_until_final_breakdown_monologue", "Trautman_as_partial_interpreter"],
        "L_loss_residue": ["war_scar", "friend_loss", "public_misrecognition", "town_damage_residue", "unrepaired_veteran_abandonment"]
      }
    },
    {
      "entity_id": "entity_sheriff_teasle_deputies",
      "entity_label": "Sheriff Teasle and deputies",
      "entity_type": "local_authority_actor_group",
      "role_vector": {
        "P_protectedness_future_space": ["public_order_role", "law_enforcement_safety_scope"],
        "H_harm_role": ["routes_coercive_harm_to_Rambo", "later_harmed_by_escalation_and_fear", "one_deputy_death_occurs_through_disobedient_escalation_in_transcript_analysis"],
        "C_control_capacity_coercion_culpability": ["high_initial_control", "evidence_interpretation_capture", "status_authority", "disproportionate_response"],
        "K_clocks": ["public_order_clock", "authority_face_saving_clock", "deputy_death_retaliation_clock"],
        "A_authority_claim": ["town_order", "police_discretion", "force_authority"],
        "R_repair_review_contest": ["weak_internal_review", "Rambo_not_afforded_real_contest_before_force"],
        "L_loss_residue": ["authority_escalation_residue", "misclassification_residue", "town_damage", "death_and_fear"]
      }
    },
    {
      "entity_id": "entity_colonel_trautman",
      "entity_label": "Colonel Trautman",
      "entity_type": "former_commander_interpreter",
      "role_vector": {
        "P_protectedness_future_space": ["not_primary_burdened_scope", "partial_witness_to_Rambo_origin"],
        "H_harm_role": ["created_or_participated_in_training_machine", "may_reduce_harm_by_interpreting_Rambo", "may_also_mythologise_Rambo_as_weapon"],
        "C_control_capacity_coercion_culpability": ["high_interpretive_authority", "partial_origin_debt", "limited_deescalation_capacity"],
        "K_clocks": ["deescalation_clock", "military_origin_debt_clock"],
        "A_authority_claim": ["expertise_over_Rambo", "military_past_authority"],
        "R_repair_review_contest": ["partial_bridge_between_Rambo_and_authority", "not_full_repair"],
        "L_loss_residue": ["created_weapon_origin_debt", "cannot_restore_lost_unit_or_home"]
      }
    },
    {
      "entity_id": "entity_town_of_hope",
      "entity_label": "Town of Hope",
      "entity_type": "community_scope",
      "role_vector": {
        "P_protectedness_future_space": ["public_safety", "property", "community_order"],
        "H_harm_role": ["later_burdened_by_escalation_and_destruction", "initially_represented_by_excluding_authority"],
        "C_control_capacity_coercion_culpability": ["diffuse_control", "benefits_from_order_story", "not_identical_to_police_authority"],
        "K_clocks": ["panic_clock", "property_damage_clock", "public_narrative_clock"],
        "A_authority_claim": ["town_order_claim_through_sheriff"],
        "R_repair_review_contest": ["community_truth_depends_on_post-event_witness_ledger"],
        "L_loss_residue": ["damaged_property", "fear", "false_public_memory_risk"]
      }
    },
    {
      "entity_id": "entity_audience_interpretive_scope",
      "entity_label": "Audience / interpretive field",
      "entity_type": "narrative_interpreter_scope",
      "role_vector": {
        "P_protectedness_future_space": ["truthful_interpretation", "anti-caricature_memory"],
        "H_harm_role": ["can_be_misled_by_action_franchise_caricature_or_police_perspective", "can_receive_witness_through_editing"],
        "C_control_capacity_coercion_culpability": ["interpretive_power", "limited_factual_access", "dependent_on_film_form"],
        "K_clocks": ["narrative_reveal_clock", "franchise_memory_clock"],
        "A_authority_claim": ["viewer_judgment"],
        "R_repair_review_contest": ["film_form_and_final_monologue_reopen_ledger"],
        "L_loss_residue": ["character_flattening_if_Rambo_is_reduced_to_action_icon"]
      }
    }
  ],
  "clocks": [
    {
      "clock_id": "clock_trauma_trigger",
      "clock_label": "Trauma trigger clock",
      "affected_scope_ids": ["entity_john_rambo"],
      "controller": "not_fully_controlled; triggered_by_coercive_detention_and_torture_like_stimuli",
      "band": "immediate",
      "hardening": "panic_survival_response_can_harden_before_reasoned_contest",
      "what_hardens": ["fight_or_flight_response", "war_frame_reactivation", "loss_of_social_context"],
      "estimator_authority_status": "PROVISIONAL",
      "affected_scope_challenge_possible": true
    },
    {
      "clock_id": "clock_authority_escalation",
      "clock_label": "Authority escalation clock",
      "affected_scope_ids": ["entity_john_rambo", "entity_sheriff_teasle_deputies", "entity_town_of_hope"],
      "controller": "entity_sheriff_teasle_deputies",
      "band": "fast",
      "hardening": "each coercive response narrows deescalation options",
      "what_hardens": ["Rambo_as_threat_classification", "retaliation_pressure", "public_order_frame"],
      "estimator_authority_status": "CLAIMED",
      "affected_scope_challenge_possible": true
    },
    {
      "clock_id": "clock_public_narrative",
      "clock_label": "Public narrative clock",
      "affected_scope_ids": ["entity_john_rambo", "entity_town_of_hope", "entity_audience_interpretive_scope"],
      "controller": "police_reports_media_story_and_film_perspective",
      "band": "fast_or_medium_context_dependent",
      "hardening": "Rambo_can_be_fixed_as_killer_or_monster_before_full_origin_is_seen",
      "what_hardens": ["killer_label", "drifter_label", "action_icon_caricature", "erasure_of_trauma_context"],
      "estimator_authority_status": "UNKNOWN",
      "affected_scope_challenge_possible": true
    },
    {
      "clock_id": "clock_reintegration_failure",
      "clock_label": "Veteran reintegration failure clock",
      "affected_scope_ids": ["entity_john_rambo"],
      "controller": "diffuse_society_military_state_support_absence",
      "band": "slow",
      "hardening": "social_abandonment_and_trauma_accumulate_before_crisis",
      "what_hardens": ["isolation", "lost_unit_identity", "no_home", "unprocessed_trauma"],
      "estimator_authority_status": "UNKNOWN",
      "affected_scope_challenge_possible": true
    }
  ],
  "claims": [
    {
      "claim_id": "claim_rambo_misclassified_as_drifter_threat",
      "statement": "Rambo is initially interpreted through an exterior label of drifter/trouble rather than through a protected-scope or trauma-context reading.",
      "claim_type": "LaunderingCandidate",
      "source": {
        "source_id": "source_user_provided_cinemastix_transcript",
        "source_type": "document",
        "source_role": "transcript_basis_for_narrative_analysis",
        "source_capture_risk": "medium"
      },
      "evidence_basis": {
        "basis_type": "documentary_record",